{"$id":"https://agent-development-skills.local/design/canonical-ui-ir-v1.schema.json","$schema":"https://json-schema.org/draft/2020-12/schema","additionalProperties":false,"properties":{"accessibility":{"type":"object"},"assets":{"items":{"type":"object"},"type":"array"},"evidence_refs":{"items":{"minLength":1,"type":"string"},"minItems":1,"type":"array","uniqueItems":true},"fingerprint":{"pattern":"^design-v1:[0-9a-f]{64}$","type":"string"},"interactions":{"items":{"type":"object"},"type":"array"},"ir_id":{"minLength":1,"type":"string"},"responsive":{"type":"object"},"schema_version":{"const":"1.0"},"screens":{"items":{"additionalProperties":false,"properties":{"id":{"minLength":1,"type":"string"},"regions":{"items":{"additionalProperties":false,"properties":{"components":{"items":{"additionalProperties":false,"properties":{"id":{"minLength":1,"type":"string"},"provenance":{"additionalProperties":false,"properties":{"confidence":{"maximum":1,"minimum":0,"type":"number"},"evidence_ref":{"type":["string","null"]},"kind":{"enum":["source","manual-contract","inference","unknown"]}},"required":["kind","evidence_ref","confidence"],"type":"object"},"slots":{"type":"object"},"states":{"items":{"minLength":1,"type":"string"},"type":"array","uniqueItems":true},"token_refs":{"items":{"minLength":1,"type":"string"},"type":"array","uniqueItems":true},"type":{"minLength":1,"type":"string"},"variant":{"minLength":1,"type":"string"}},"required":["id","type","variant","slots","token_refs","states","provenance"],"type":"object"},"type":"array"},"id":{"minLength":1,"type":"string"},"layout":{"minProperties":1,"type":"object"}},"required":["id","layout","components"],"type":"object"},"type":"array"},"states":{"items":{"minLength":1,"type":"string"},"minItems":1,"type":"array","uniqueItems":true}},"required":["id","regions","states"],"type":"object"},"minItems":1,"type":"array"},"tokens":{"type":"object"},"unknowns":{"items":{"additionalProperties":false,"properties":{"blocking":{"type":"boolean"},"id":{"minLength":1,"type":"string"},"reason":{"minLength":1,"type":"string"}},"required":["id","reason","blocking"],"type":"object"},"type":"array"}},"required":["schema_version","ir_id","evidence_refs","screens","tokens","interactions","responsive","accessibility","assets","unknowns","fingerprint"],"title":"Canonical UI IR v1","type":"object"}
