{"accessibility":{"settings":{"dynamic_type":true,"reduce_motion":true,"voice_over":true}},"assets":[{"id":"icon.save","semantic":"save"}],"evidence_refs":["evidence-80a00c9e42a17c9a"],"fingerprint":"design-v1:99655a49b4d2690240780ac983d58648e38aad20648a733dff6dd18a07c7bca5","interactions":[{"event":"tap","from":"default","id":"save","to":"loading"}],"ir_id":"ir-ff6dd18a07c7bca5","responsive":{"settings":{"compact":{"footer":"fill"}}},"schema_version":"1.0","screens":[{"id":"settings","regions":[{"components":[{"id":"save-button","provenance":{"confidence":1.0,"evidence_ref":"evidence-80a00c9e42a17c9a","kind":"source"},"slots":{"label":"Save"},"states":["default","disabled","pressed"],"token_refs":["color.action.primary"],"type":"button","variant":"primary"}],"id":"footer","layout":{"alignment":"trailing","kind":"stack"}}],"states":["default","loading"]}],"tokens":{},"unknowns":[]}
